Item Id,Sentiment,Tweet
635769805279248000,negative,Not Available
635930169241374000,neutral,IOS 9 App Transport Security. Mm need to check if my 3rd party network pod supports it http://t.co/fmtcfUAdgj
635950258682523000,neutral,"Mar if you have an iOS device, you should download our app too: http://t.co/gl3tn2uDnD"
636030803433009000,negative,@jimmie_vanagon my phone does not run on latest IOS which may account for problem the other day .. time it was replaced
636100906224848000,positive,Not sure how to start your publication on iOS? We'll be live helping with ask me anything sessions today and Friday http://t.co/KPqqGjjh3x
636176272947744000,neutral,"Two Dollar Tuesday is here with Forklift 2, QuickKey for iOS and Suite for Pages for just $1.99 today:   http://t.co/BNMFOEACw5"
636276311560859000,neutral,"If you're not already signed up to test my iOS game, nows your chance! https://t.co/eZhIU6EDpQ"
636302400546975000,neutral,"YouTube Gaming Officially Launches On Web, Android, iOS On August 26: YouTube is finally going to r... http://t.co/qbhyA3kaWP #webseries"
636356154151575000,neutral,YouTube Gaming Launches Tomorrow with iOS and Android Apps to Go Head-to-Head with Twitch http://t.co/yZOATToeJC #ios #game
636360240921972000,neutral,@astrill Yashan from BBC @bbcchinese the VPN access on IOS may be limited during China's military parade? Any chance to have a chat on that?
636440904967061000,positive,Parkrun app for iOS downloaded Where have you been before ?Great app easier access of info &amp; ready for Saturday's run http://t.co/ZyOFhZeRIO
636484190050119000,positive,"Today @YouTubeGaming launches, with apps for iOS and Android devices in the US and UK, here is what you need to know http://t.co/Kf8DgnHX9b"
636567666048794000,positive,Got a project you want to work on? Need help with Swift? Need an excuse to hang with iOS devs on a Sat? Hang with us! http://t.co/pUWsKbDfWe
636724154260176000,positive,"Met with iOS Developer today. We may have a ""go"". 8-)"
636828460820729000,positive,#CrossSkyHigh is going IOS #saturday. For now try this http://t.co/Jrc6ktK9rT #indiedev @GamerRTer @ShoutGamers http://t.co/bkWUjKEmju
636878337105920000,positive,What's the best way to get audio recordings from a 3rd party app off of an iOS device? Jailbreaking isn't an option.
636907592036388000,positive,Five Great Free Apps and Games for iOS - August 27th Edition:  It's that time of the week again... http://t.co/QGkrIrKI28 #News #LCHBuzz
637003894611148000,neutral,"@clayrussell @Nostradamion looks interesting but I've ALWAYS ended up back on iOS keyboard, always glitches with iOS 8/9 3rd party ones"
637018128111693000,positive,"See news through the eyes of real people &amp; be your own reporter with Fresco 2.0 for iOS, coming September 8th! http://t.co/IfLPLqqsmy"
637085524683976000,positive,Siri knows all about #Apple's iOS event on the 9th. #GiveUsAHint http://t.co/sHmTw46ELR
637103428494188000,positive,"Who's ready for 0.12.1 Build 12 Tomorrow, Might be the last build till it come to iOS !"
637176985479970000,positive,"@facebook As I've been on FB for many years, I have a few hundred photo albums, but only the 1st 200 appear in the IOS app. Is that right?"
637244817974657000,positive,@Yurt try beat mp3 it may be on android i have it on ios and its fairly decent
637268613263720000,positive,@androidcentral Even though there are other differences in the IOS features this still may make people lean a little more towards Apple.
637333676099932000,neutral,Huawei Watch Pre-Order Suggests Android Wear Coming To iOS: IPhone owners who want to use Android Wear may soo... http://t.co/JQhdN5tCUV
637423522130825000,neutral,SpeedeNews: Rumor: Android Wear will soon work with iOS - Android Wear may be very close to working with iOS. That... http://t.co/pq0g0Z3eOy
637515323059646000,neutral,"Over here in NW near 11th &amp; Rhode Island, if you need a Lyft let me know !  Download the LYFT app for IOS or Android !"
637559397707874000,neutral,@NarisDRIFT @T_Dogg_94ebooks I wish that CustomFolderIcons worked on iOS 5.1.1 and it was received on December 11th.
637567051490455000,neutral,So today i checked my old iPod 4th gen which is on iOS 6.1.6 and it can't be upgraded further and i randomly open twitter
637581604253224000,negative,"@_tomcc @bartwerf please stop walking and work !! You have more than one month of late --"" The update was annonced the 29 of july, IOS wait!"
637615314897928000,positive,"@notch  Hi i have heard that they said MCPE update 0,12,0/0,12,1 will come today 29 august to ios but i cant see that there is the update:)"
637878764207214000,neutral,@Terraria_Logic do you have any news of an update in October for ios and android users
637976948124160000,neutral,"@alexdong a follow-on guess might be that if you are female, with an iOS device, visiting the site, you may have more disposable income?"
638206033639292000,positive,@tim_cook loving my new iPhone 6 from T-Mobile I'm in love with iOS! Can't wait for the Sept 9th event
638380514252992000,neutral,@M3RKMORK @MKBHD all Android wear is comparable with iOS now I believe. I may be wrong though
638407042512719000,neutral,Google Expands Android Wear Smartwatch Platform to iOS -  Google on Monday rolled out Android Wear smartwatch harmony with ...
638427398694830000,negative,"@DeltaAssist yes, I asked an attendant to print out a paper pass. But this was not the 1st time delta IOS app lost my login info. Annoying."
638429626419671000,positive,The two companies announced a partnership Monday aimed at making iOS devices and apps more compatible with... http://t.co/VeEFWrIUA9 #FF
638458599803502000,positive,@rwang0 zeroes in on the latest in a short video. Making iPhone &amp; iOS great for enterprises. 1st @IBM &amp; now @Cisco. https://t.co/pheh3U4uxE
638459896296538000,neutral,To all Nintendo fans out there; I may sound crazy when I say this but Kirby and the rainbow curse and/or Kirby canvas curse should be on iOS
638551243653165000,neutral,"Apple hasn't ever focused on gaming, but has enjoyed incredible success with iOS gaming. Apple TV may focus on games: http://t.co/Qn3wgy1KU7"
638589551997513000,neutral,@TimRaphael215 may want to pick your brains - looking to get into iOS dev myself.
638614098482065000,positive,The Orks are here to tell you that we're gunning for a Sept 30th release of Herald of Oblivion on iOS and Android! http://t.co/ZwGO1iDqo0
638703996379746000,neutral,"@deba1602 3rd party app on iOS, Does it add a keyboard or you have to type -&gt; copy -&gt; paste ? @debabrata2008"
638776033215447000,neutral,M/T Webroot: Have a jailbroken iOS device? You may want to reconsider. http://t.co/2QFA6jFLNf
638828126097682000,neutral,"@icj_ i have the Ipod Touch 5th and i have the IOS 8.4.1,ofc i cant downgrade because 8.4 is not being signded,so now what i supposed to do?"
638857391686184000,positive,"@arekdreyer Making my way through your Managing iOS and Macs 2nd Ed. book. Great read, really well done! Thanks for doing this; keep it up."
638886628602155000,neutral,"Google's Android Wear for iOS confirmed incompatible with Apple's HealthKit: In announcing Android Wear for iOS on Monday, Google not..."
638927700648964000,neutral,@LeeQVC Hi Lee my iPhone is currently operating on IOS 6do I have to put IOS7 1st or can upload IOS8 if so how do I go about it ?
638945625548173000,positive,wed night 7pm pacific join the The BLAST! live right here on FB as we have the founder's of the IOS app Kander on... http://t.co/XgeUKCqd6f
639001381655982000,positive,codigames:Do you like ARPGs?Dungeon Legends arrive to iOS on September 3rd http://t.co/17VP9iXAxj #gamedev #iphone http://t.co/vGQF11yE2H
639016946541850000,neutral,Jailbreaking iOS Devices May Not Be The Best Idea: Security vulnerabilities in the iOS can rarely be... http://t.co/yAATcrXOrU #security
639071474754711000,positive,"Come and have the FIRST EVER GO on Lumino City on iOS @SomersetHouse @nowplaythese + real models, Friday til Sunday! http://t.co/GXdkU8COnj"
639085295351132000,neutral,Rumor has it that a certain app is available on iOS and it's FREE.  Android coming Friday. http://t.co/JXNaqgUWaz
639115503492038000,neutral,@steveballin So far we've announced iOS and Android versions and we focus on them. This may change in the future though.
639117172204138000,neutral,"@MyersNFL May favorite one EVER on iOS is Harbaugh, it autocorrects to Garbage"
639217575298248000,neutral,@MKBHD do u know if the moto360 2nd gen will work with iOS devices??
639289589396541000,positive,Not Available
639456517008326000,positive,My best guess is we should see MCPE0.12.0 submitted to IOS and Google by the end of week or into Monday if the devs have cleaned up the bugs
639485295218585000,positive,The next Pixel Dungeon update for Steam and iOS with a lot of new features and improvements will be released on September 4th.
639542718117490000,neutral,Thursday Night on KXLU! Get the @KXLU889 app for IOS or Android at http://t.co/hDxy5DKgp7 and LISTEN! http://t.co/bjODczV0MF
639586654492205000,neutral,Not Available
639731200492482000,neutral,Been using Vodafone's smart ultra 6 since Tuesday. Can't get the hang of it and finding a few faults with android. Back to IOS I think...
639806019665793000,neutral,"Meet your new (old) favorite endless runner for iOS, Race the Sun - Macworld http://t.co/or8gZl9CsG"
639825263187128000,positive,"Are you ready for our new 2048 app launch tomorrow? Build binaries for IOS, Android, Windows Phones and Tablets.... http://t.co/pmCGUUu6cL"
639886266843164000,neutral,@flyshorts BTW I &amp; others have run into a fair number of cataloguing issues with the Apple Music update in iOS 8.4. This may be a symptom.
639899879955935000,positive,This hopefully means that MCPE will come out for IOS around the 8th of September along with all other versions!
640017715894206000,positive,What you should look for from Apple's September 9 event: A new version of iOS will likely arrive with those sh... http://t.co/TcdFrMhODo
640163020539203000,neutral,Want to speed up your sharing? Automate a few things from your iOS device? Workflow may be the solution. http://t.co/cVkMkRCeDq
640184988172963000,positive,@RobloxLeaksFTW thank you now I may actually have a chance on ios now
640305299270799000,positive,articlesection classpagepAndroid Wear may be very close to working with iOS
640324452731875000,positive,Not Available
640329967826440000,positive,Not Available
640350165879144000,positive,@_tomcc Hey Tommaso when is the release date for 0.12 on iOS? If the answer is around the 8th thats where my school starts!
640506480488153000,positive,Not Available
640515279873830000,positive,1 DAY.#CrowdViz releases on Labor Day September 7th! An IOS app that unites blind people with sighted assistants. http://t.co/fNXqXa685P
640604280706076000,positive,WHO CANT WAIT FOR MINECRAFT 0.12 ON IOS BUT NOW U DONT HAVE TO WAIT CAUSE IT WILL BE SUBMITTED AT 8th september 1 day left
640640481714638000,neutral,It's quite funny to see iOS developers taking advantage of the new Ugmonk 6th Anniversary set!
640719733940191000,negative,Not Available
640862561236185000,positive,"@KymLang links are working fine on my IOS device. Some times on the first click I get a ""open in safari ?"" Cancel it &amp; do a 2nd click. Works"
640985843851767000,positive,"@darngeek all device build 14 tomorrow or official (WP,android,IOS) ? Hehe :P yay happy day for you ..."
641021806061621000,neutral,@_tomcc so the 12.0 for IOS will be out tomorrow correct??
641105483122798000,positive,Tech: Android&gt;Star Wars: Uprising launches September 10 on iOS and Android - GB: Star Wars canon is about t..http://t.co/oiTvPxGfby #mobile
641288798790418000,positive,@_tomcc hi I was wondering do u mean you'll try to release MCPE 0.12.1 to iOS tomorrow??? Ps your awesome
641393171008720000,neutral,Not Available
641433564836290000,positive,Check out my ride in #CSRRacing for iOS! Try it for FREE! http://t.co/BvKgJ02yP8 now car http://t.co/PLHShHhLA0
641438788472991000,neutral,Apple releases what the next iPhones and IOS will be like tomorrow
641441832291934000,positive,You can download 0.12.0 for iOS and the show or server won't work until tomorrow be happy and SMILE MORE =)
641482982688075000,positive,"Those of you with iOS devices, ask Siri to ""give you a hint"" about tomorrow's Apple keynote. http://t.co/pfQkdUDchQ"
641485888673812000,positive,I don't operate any iOS devices anymore but I'll still tune into the big show tomorrow. Still fun to watch the event and see what's what.
641488560437260000,neutral,@pedstrom Not sure what you mean. Continuity doesn't require a separate 3rd device (Watch) for two (other) iOS devices to pair and share.
641494998010200000,negative,ok inbox on iOS has a pretty animation for the sun but thew android version doesnt :(
641542106306101000,neutral,@AGPlaya the only time i would say i really enjoyed IOS was fifa 14 before i got my console in may soon as i got that i stopped playing it
641632558996811000,positive,"Wanna watch the iPhone announcement... LIVE? With any iOS device (Safari Browser)... watch here, starting 10 AM PST: http://t.co/ty3GDrguxn"
641642814632124000,positive,"ATTN: Beginning Oct 1st, Munzee 3.0 will be the only app available for iOS and Android. Also, 3.0.1 is in review and includes bug fixes."
641653401877618000,positive,Did you know that we are launching @eccgames's Tower Dwellers Gold on Android tomorrow in tandem with iOS?  https://t.co/PIBCmp1bzd
641655091468963000,neutral,http://t.co/DeGqRngcwk: iOS Developer  TH-Bangkok: Market Rate:  http://t.co/DeGqRngcwk: My client is the larges... http://t.co/kYSJ5sThUE
641670426284945000,positive,"Like legit though, if it was running OS X, it would be a sick product. But since it's running IOS you may as well get a retina 13"""
641323950056841000,positive,Join the MOVable Challenge! Get your MOVband at Spirit Fest tomorrow or Thursday and move one step closer to an iPad! http://t.co/QEv1anI83s
641328263822999000,positive,"tomorrow is another big day in the tech world! I'm guessing a new upgraded  iPhone, iPad, and possibly new OS! http://t.co/ro5a6NIgAa"
641328586276925000,negative,Lost my iPad for the 2nd time today
641333614945378000,neutral,Not Available
641336034672922000,positive,Woods Club! @CHSWoodsClub Come to room 175 after school next tuesday to make iPad Stands! http://t.co/U0aqa81PWW
641341629689786000,neutral,A survey question ahead of tomorrow's announcements: What's the right price for an 12.9-inch iPad w stylus and keyboard cover??
641342629074984000,positive,"Really excited about Apple Announcing iPad Pro tomorrow. Ah, the rumor I've been wanting to be true for years. It... http://t.co/BNFovY0ZBZ"
641345456740503000,positive,So excited to see what #Apple announces! My wish - a huge iPad that I can draw on with a stylus http://t.co/FeTK7rajmb @WIRED #tech
641349256020815000,neutral,Apple might want to give devs a little info on iPad Pro before dropping it and iOS 9.1 on the market in November. ht: @apollozac
641351041884164000,positive,Sat next to a woman on the plane today who flipped through photos of her cat on her iPad the whole time. #spiritanimal
641351360965832000,positive,Tomorrow the day Apple reveals a new iPhone &amp; iPad #SoAnxious I want both items ASAP!
641352166305693000,positive,"Prediction for tomorrow: iPhone 6c, 6s and 6s+; a 12"" iPad and a new Apple TV with touchscreen controller. #applegenius #stillnojobthough"
641357966315139000,positive,"Rumor is that Apple's big announcement tomorrow is a giant iPad. Please, God -- please let them call it the MaxiPad! #AppleEvent #Apple"
641366721287204000,positive,"Tomorrow: Capturing Covent Garden with iPhone and iPad 9 September, 10:30am, Apple Store, Covent Garden. #Free http://t.co/HLqZo2ff8G"
641376359034568000,negative,"I'm at my follow limit. Rude. I will go on my iPad tomorrow and unfollow all the little bitches who ain't following back. K, bye."
641378641339940000,positive,Wouldn't be surprised if the new iPhone unveiled tomorrow is actually an iPad mini
641383082923196000,positive,@coorz00 thanks tea sounds good but gotta update the iPad 1st
641384489860526000,positive,Not Available
641392431653453000,positive,I hope they announce something different and exciting for the iPad tomorrow. It's just about time for me to get a new one #AppleEvent
641393122216423000,positive,"Reading @daringfireball's prelude to tomorrow's Apple event, can't help but think @gruber is the new WSJ, Bloomberg, or NYT re: iPad news."
641402358564548000,positive,Traded in the new computer to get an iPad. Uncle tells me new iPad will be announced tomorrow so prices should drop. http://t.co/3Xgg14mX62
641403638267535000,positive,"Apple's Keynote is happening tomorrow at 3am!With the expected announcement of the iPhone 6S, new Apple TV and iPad who is waking up for it?"
641404618094723000,neutral,Not Available
641406276879187000,positive,The only thing I'm looking forward to tomorrow is the new iPhone and iPad Pro
641408450463817000,neutral,what she gonna buy with $200? 1/4th of an ipad  https://t.co/SL79vF03CE
641411462121058000,positive,I hope I get my iPad tomorrow so I can stream the Apple Keynote Address in school
641413378976518000,positive,Not Available
641414401426223000,positive,"Does it really have iPad pro &amp; stylus, tomorrow will have answer!!!"
641416176304680000,neutral,@Dennisd1971 if you are using an iPhone or iPad you may not be able to view it their youtube app.  Try on your computer.
641417400110354000,neutral,"Tomorrow, #Apple better introduce an iPad large enough for me to stand on, with an app that'll transport me wherever I want to go. If not..."
641418673014620000,positive,"But with a new iPad coming out, I may be able to snag an older iPad at a decent price."
641419174363930000,positive,First day of school tomorrow which means it's also the first day of the season for RBI baseball on my iPad
641423309318582000,negative,"are yall really mad that he's paying $200 to fix a broken iPad, don't yall have bigger problems to deal with  https://t.co/bDigQfbZOd"
641424370942939000,positive,And Apple goes gesture controlled gaming with Apple TV. Will the phone and iPad upgrades impress?  https://t.co/nAwH8kht9B
641424651495698000,positive,"#Apple to unveil iPhone 6s, iPad today. For the first time they are releasing on Wednesday. All their earlier releases were on a Tuesday."
641425847791042000,negative,When you have 3 1/2 tests tomorrow and a lab to do but your iPad is dead so you can't do shit :):):):):):)
641430507683606000,negative,Highly doubt that iPad will be covered during the #AppleEvent tomorrow. https://t.co/qndgNTztqa
641432777615933000,positive,"So tomorrow is the big Apple event. What do you think we'll see, iPad Pro? An iPad Stylus? Curious to see what they bring."
641435029617442000,neutral,Not Available
641436035013038000,neutral,"Checks 2.0 will not be submitted tomorrow, but I'll end up taking the extra time for a watch app, NC widget, iPad optimization, etc."
641436513390080000,positive,@LOHANTHONY my moms taking my iPad away tomorrow but it's worth it because I'm tweeting the KWEENT #ANTHONYCHAT
641436882128248000,positive,"Which is more interesting unveil tomorrow? $AAPL 6s, Ipad, TV or $TM new Prius? I'm going with Prius."
641442231409242000,positive,"To prepare for the #AppleEvent tomorrow I am reminiscing over legacy apple hardware including iPod 2nd Gen, iPhone 4, iPad 2. Get Pumped!"
641444286341365000,positive,"Sundays vlog is processing, Monday's is exporting... You know for having to do it all on a iPad is say I'm doing pretty good."
641445586445537000,positive,@film_girl I'd buy the next iPad if they had Fassbender give the keynote tomorrow.
641447893677817000,positive,I believe the new Twitter update comes in time before tomorrow event. Might be seeing deeper integration with iPad Pro? SplitScreen!? #iOS
641447913525276000,positive,"Tomorrow, Apple Inc. will introduce the 6S, a new Apple TV and the iPad Pro."
641451096427266000,negative,Accidentally left iPad sitting in the sun too long. Had to stash her in the freezer to cool down #whoops #straya
641457212754280000,positive,Not Available
641460027002355000,neutral,"@Qantas hi, i've trying to contact quantas bu phone with no success since last thursday...i left an ipad in a plane, could you help me?"
641479328216150000,negative,My dad just dramatically got upset at me for no reason but I was getting an iPad tomorrow so now what
641480750265602000,positive,@pierce hahah. Excited for your live blog tomorrow. I know the rumors are strong but I remain dubious about the iPad pro being announced
641483234996436000,neutral,@Celeste_pewter I can't tell if it is working on my blog I will have to check tomorrow on the computer. I was using my iPad.
641493880555347000,positive,Why spec Noritz? We want to know! Submit a vid before Oct 31 explaining why &amp; you could win an iPad! http://t.co/QNPOTCjrK1 #NoritzPro
641501437675986000,neutral,I still doubt Apple will announce new iPad at tomorrow's event. Apple might dedicate most of the keynote on new Apple TV.
641501884243689000,positive,"@KimCummms I see. I hope it will survive. If not, you only have new when things break. Apple may announce a big size iPad tomorrow"
641510515974365000,negative,"ok so i want to cry like, my expected delivery date for my ipad is thursday which is AFTER i leave like this is the absolute worst"
641511906897883000,neutral,Uniting until yours postexistence bandeau it may be take effect actuary out the ipad onwards from desktop verge...
641515406319071000,positive,"#Apple is expected to unveil 2 iPhones, an Apple TV &amp; a larger iPad. Watch the live stream tonight at 7pm here http://t.co/QwoJ0yway0 #tech"
641524008987566000,neutral,"Should you upgrade from #Adobe #CS6 Suite? CS6 came out before the 1st iPad mini was released, in the same month Facebook bought Instagram!"
641526339636457000,neutral,"@daringfireball if Apple wants to sell me an iPad, they'd better announce it tomorrow"
641528223457746000,neutral,"#Apple to show the #iPhone6S, updates to the iPad, Apple TV and other products today http://t.co/2fSV8hScJa"
641539550104281000,neutral,1st u knew dat there wud b a lot of ppl chasing after harry so y'd u bring ur ipad w/ u U couldve just used ur phone https://t.co/5MSumtur1K
641539752177586000,negative,And 2nd it wasnt harrys fault that he had ran over your ipad so whyd you ask him to pay for the crack like wtf https://t.co/5MSumtM2qk
641560030945259000,neutral,Literally anxious abt the iPad pro announcement today. You gonna disappoint again Apple or is it srsly the 2nd last product I'll need from u
641560327159726000,positive,If your pupils can use an iPad better than you can then this course may well be ideal for you - http://t.co/8innWbrMqY
641562858245918000,positive,Not Available
641565807810617000,neutral,1st he smashed someone's phone now ran over an iPad he hates you all https://t.co/Vxn34DDrk6
641574514619514000,positive,"Also, the iPhone 6S, 6S Plus and the new iPad will be coming out tomorrow morning! Will be checking out the highlights."
641579580176732000,neutral,@darebeark @alyaeldeeb12345 my memory  doesnt have more space. So i cant download it :( but i'll try to download it tomorrow from iPad
641584057386704000,neutral,@garrettc Do you think it knows that in a couple of hours it may be one step closer to obsolescence (and outpaced by a giant iPad at that)
641584758204575000,positive,Not Available
641585407252123000,positive,Not Available
641592893841481000,negative,Pausing on this day of my 31st year to yell at my ipad because pandora refuses to play the Carpenters' Superstar.
641595961068900000,positive,Giant iPad anyone? Don't forget to check out the Apple Event at 1pm EST. #apple #charlotte http://t.co/uOVQhibSJ2 http://t.co/GVhKOJPUIJ
641597241141129000,neutral,Just $6.99 for the Hebrew Crash Course by Friday. Get Survival Phrases for the iPad or Mac: https://t.co/O4YGQFgtaa http://t.co/NczpkYotRo
641602592401821000,positive,"iPad Pro, Apple TV expected to take center stage Wednesday: It's that time of the year. For five years, Apple ... http://t.co/eHpn3KzylM"
641603220977131000,neutral,Top 5 Gambling Apps for the iPad http://t.co/2JbwPxRzY8
641604722043039000,positive,Can't wait to see the iPad Plus .... #Apple #AppleEvent #TimCook  https://t.co/qiR5JjDdjp
641608296160448000,neutral,The Accounting Career Fair is this Friday! Be sure to engage with us by using #kubusfair--you might win an iPad mini!
641610320293695000,positive,"New iPhones, iPad Pro, and Apple TV on the way today at 10 A.M. (PDT)! #AppleEvent http://t.co/WLFT7hrxH8"
641618110835888000,neutral,"I wanna go find the iPad so I can watch videos and train muh pokeymanz, rip iPod D:  tomorrow marks two weeks"
641618508028248000,positive,Is that I am very excited to share on Instagram brings their app to iPad and redesigns the iWatch in November.
641621458293276000,neutral,wait...I may reconsider my decision to get surface pro 4 if ipad pro comes with a stylus with pressure sensitivity
641625805508841000,positive,#castleberryisd 5th grade iPad Deployment going well! Students are excited! http://t.co/hcPY5IR8ZM
641629037337559000,neutral,@mmmhotbreakfast @mickmolloy I can't stop hope the iPad goes flat I gotta work tomorrow. GO TIGES GO TIGES GO TIGES GO TIGES GO TIGES..
641630235050405000,positive,Happy Apple Fanboy Day! May the iPad be with you.
641633293729943000,positive,It was fun to see the excitement on the 6th graders' faces. And some of them seem to be iPad pros already! https://t.co/YnZtTTyg4W
641634655310086000,positive,1st gen iPad mini still going strong. Love that little guy.
