Item Id,Sentiment,Tweet
638494431809785000,positive,"So here I am, 00:30 in the morning sat looking for updates on the situation on Twitter and Madonna, material world comes on. Brilliant"
638535750309384000,positive,"@UnbrokenHooker @lindsuslordhan @TeddyUniverse And Madonna didn't beg for shit. Her album may not have hit, but she's selling out a tour"
638671988702101000,positive,"On September 1 2012, Madonna performed her MDNA Tour on the Plains of Abraham in Quebec City. A sold out crowd of... http://t.co/4qmB6Gddkj"
638712557793112000,neutral,"Zayn? Jlo? Madonna? Selena? Jlo? If we are talking iconic instagrams...  Kylie,Gigi,Kendal even Bieber make sense https://t.co/VdwfPWc2Mb"
638758216223076000,neutral,Madonna performing in Montreal on the 9th and 10th of September if you're looking for tickets give us a call at... http://t.co/X62xi4Dohs
638821097215922000,neutral,"April 17, 1986 Madonna at the At Close Range premiere http://t.co/Lw4T3AplZF"
638935375520509000,neutral,"May 28, 1986 Madonna on the set of the Papa Don't Preach music video on Staten Island, New York City http://t.co/oE6UeOlprN"
638989396654469000,negative,@musikate @catawu @cmbsweden @verge sorry her shenanigans eclipse any real talent she may have..at least Madonna was strategic w/shenanigans
639136004935258000,neutral,"In other news, I heard Borderline by Madonna at lunch on Monday and just caught myself humming it 2 days later and I'm kind of freaked out."
639164139995299000,positive,@musicnews_YT Beyonce (19) is soon beating (or going to tie) Madonna (20) for most VMA awarded artist. Lady Gaga is 3rd so far
639189058590257000,neutral,I rly hope madonna wont release rebel heart as the first single  i mean i rly like it but its not 1st single material
639226620109320000,neutral,"Madonna put in two during the first half of play. #HUWS came out stronger 2nd half, but ends game scoreless. 2-0 Final Score"
639400403348549000,positive,"On September 3 2009, Madonna's Sticky And Sweet world tour was named the highest-grossing for a solo artist ever.... http://t.co/kySPk36P1C"
639401660595466000,positive,If you like old school Madonna you may like this  http://t.co/op0LV6gnfk http://t.co/C7wzkq2TkO
639407838872383000,positive,"Really though, who wants to come with me to the Madonna concert on the 24th? I have an extra ticket"
639436190706475000,positive,Remember when Madonna tried acting a bit back in the 1980s? #RickiAndTheFlash is out tomorrow:http://t.co/dwvgFybCVB http://t.co/xIRXteUBcH
639476499041644000,negative,Not Available
639523388361474000,neutral,"@Bexdora tomorrow I think it'll be Madonna's ""Like a Prayer""...  Can you help me with this please? Everyone must stand alone. Sorry."
639526046732124000,positive,@TheEllenShow @Madonna and when I go to see Madonna in march I'm going to pretend its really you up on stage. I'll never forget u Ellen!
639543984914866000,neutral,"On September 3 1983, Madonna's first album debuted at #190 on the Billboard Top 200 Albums Chart in the USA. The... http://t.co/cstsl5OJo7"
639550944674480000,neutral,There is a rumor going around that Madonna's new single will be released tomorrow. Don't believe in this lie!
639694851542532000,positive,It's Friday and the end of a short week...Result!! Lets celebrate with @jtimberlake and Madonna after 8am this morning! Dave &amp; Heidi x
639718467617357000,positive,Listening to old school Madonna before heading out for a Friday night in Brisbane with a mad Italian #cherish #Madonna
639760084705386000,positive,"On September 4 1987, Madonna performed Causing A Commotion live via satellite from the Stadio Communale in Turin,... http://t.co/qWtVePNbAI"
639855558170968000,positive,"@VanSickle8GMS You can resort to the old Madonna hit ""Holiday!.....Calibrate!""if need be. That may have pre-dated you, however."
639884524038553000,positive,"On September 13, there will be a blessing of CLC at the 9pm Mass in Madonna della Strada. All are welcome. See you there!"
639906461800361000,positive,"On September 5 1991, Madonna's The Immaculate Collection won Best Long-Form Video at the 8th annual MTV Video... http://t.co/hrDNFZJiPm"
639906464614739000,positive,"On September 4 1993, Madonna's fifth single taken from her Erotica album, Rain, moved to #17 on the Billboard Hot... http://t.co/dpavJ8zYwW"
639913868265922000,positive,"Sunday, we're striking a pose with #Madonnarama! Join @DJRileyYork for an all Madonna dance party til 4 am! http://t.co/MmMNEQH0XR"
639982680692625000,neutral,I wonder why Drake didn't release the 2nd verse on Madonna all at once. I think it's better than the first one.
640018785496207000,neutral,"L L #Madonna In the Beginning [Gravity] by Madonna (#CD, Aug-1998, Gravity (USA)) #Celebrity #Buzz http://t.co/FCJUGuZ9os"
640037120623673000,neutral,"So what if Madonna thought BTW was ""reductive""? Is she not allowed to have an opinion or be honest?? https://t.co/kTNG9ZAams"
640165933730934000,neutral,"Weird Madonna concert dreams this morning. Speaking of, I have extra tickets. Let me know if you're interested. September 16, MSG."
640170929964883000,positive,Your #Saturday #Satisfaction with Madonna - Don't Cry For Me Argentina http://t.co/CvHFOMO1tN #80smusic #top40
640172754205999000,neutral,Not Available
640235912023175000,neutral,"April 21, 1985 Madonna performs Like A Virgin on The Virgin Tour in Costa Mesa at the Pacific Amphitheatre http://t.co/H4nfi8LVpU"
640237892539940000,neutral,"A 70-yd. screen pass TD makes it 21-7 Tusky over Madonna, early in the 3rd. Scoreboard powered by http://t.co/sRKmDHBEen."
640335090606841000,positive,Not Available
640377108016050000,positive,Ready to see Madonna on the 19th
640389442503618000,negative,"@THR She has the right to disagree. I hate Madonna! But don't think she should be stopped singing her shitty songs. 1st amendment, bro!"
640395760073224000,neutral,@TheCatholicOne @Melania1STLady This is such a breach of the 1st amend that EVEN Madonna's GAY brother is standing with KIM! Const. attacktd
640508164258033000,neutral,@ohmadonnaa It's on Madonna's Facebook page hun. If you don't have Facebook it's also here http://t.co/PJ8pN7m7IS
640619215792140000,neutral,"On September 6 1989, Madonna performed Express Yourself  at the 6th annual MTV Video Music Awards at the... http://t.co/qWXvJ15VUf"
640705457070456000,positive,Is anyone trying to go with me on September 28th to see Madonna?
640733250776879000,positive,"@CeciBeaEle Yes, it impressed me I was there in person last September, almost exactly one year ago...The Madonna is huge, so beautiful!"
640733666096779000,positive,Pic of what I got to experience Friday Before the entire world get to see it.  :D Madonna performing Dress You Up... http://t.co/HWBtfTCnEH
640749840448618000,positive,"'Secret' may sound like a love song, but it's really about spirituality and self-empowerment. It's about God being in all of us - Madonna"
640798208784998000,positive,Going to see Foo Fighters in Edinburgh tomorrow night but for now it's Madonna on Spotify shuffle.
640821894283952000,positive,Gonna listen to Madonna all day until nov 7 #RebelHeartTour #prague
640892651177426000,positive,Book now la cala this saturday is madonna tribute night back to the 80s m3ssanget and my dancers will will be... http://t.co/cmNuIvM48S
640907768325611000,neutral,Why did no one tell me Madonna is going to be at the Verizon center on Friday!?
640918530041507000,positive,I'm gunna look exactly like madonna tomorrow at the fashion show
640930126981672000,positive,"On the phone to HMRC who asked my 1st name then said ""Do you have a second name?"" Tempted to say no-like Rihanna, Madonna etc-just 1 name!"
640942177170800000,neutral,"Nope. Still half-asleep. More dancing. Seems like a Madonna sort of Monday, so on with a Bonus Song of the Day:  https://t.co/D3gxkxHngb"
640957838693679000,positive,"""This is the wave + the sun in one symbol"" ... ""This is the symbol for Batman"" ... ""I got the symbol for Madonna because she saved my life"""
640959801892163000,neutral,"@AndThatsMadonna @tiknamonster @BloodyBurqa @AidanUnderYou Madonna's albums may flop, but she can still gross high from a tour nowadays."
641010229270958000,positive,@nickcapra @Madonna @YouTube Nick are you going to see Madonna on this tour. I'm going on September 28 in Chicago. I can't wait!
641159289994809000,neutral,Madonna will make her first appearance in Hong Kong on February 17th at Asia-World Arena...
641206306720870000,positive,TRUE BLUE by MADONNA was no.3 in the UK album charts on 8 September 1986
641210188675084000,positive,"May the angels protect you, and sadness forget you. - Madonna, Little Star #songlyrics"
641220766877511000,positive,Just one more day to go -&gt;&gt; Madonna's Rebel Heart Tour starts tomorrow. What to expect?! http://t.co/OXCAc47pTi
641231953027596000,positive,@snunzie2014 anytime ..@ 8:40 this week they r giving away Madonna tickets too if you wanted to try to get in for that show for Saturday too
641237675056476000,positive,Not Available
641238282546868000,positive,Sure jan. the queen is Madonna and always will be. Get the fuck over it  https://t.co/eueKnyZmmU
641251482474577000,positive,Tomorrow is 80s day and I don't wanna be the basic Madonna but iTS ALL I HAVE. WHY THE 80S WHY NOT 70S.
641295610499477000,positive,Not Available
641299887829708000,neutral,"@alauwasser If it keeps making money for HBO, they may have to start going to former colonies as well. Or even have to take Madonna."
641323736982007000,positive,"I have to decide am I going to go to a Madonna concert on Saturday. Could be interesting. That's gotta be a 3-4 hour show, right?"
641327838566682000,neutral,Why did you keep Madonna 4th in that grossly inaccurate tweet #AskMusicNews_Facts
641365936851673000,neutral,A primer on Madonna's Rebel Heart Tour: The tour kicks off at the Bell Centre on Wednesday and Thursday. http://t.co/BOzlp4MnMU
641378155328991000,negative,"@HolyQueenOfPop @the_mdna_world the poor things are so jaded!  Nobody cares about gags, Madonna is going to shit on her premiere tomorrow!"
641393021104324000,negative,Oh! So bummed @NYHiltonMidtown has no rooms avail on the 16th! Where the heck am I supposed to stay when I see Madonna?
641400169574105000,positive,@_lecks_ @Stradiwhovius nah m8 always start at the beginning and see the evolution madonna's 2nd and 3rd albums are perf)
641448902596653000,positive,Just got Madonna tickets for the 2nd night at MSG for myself and  Matthew Carl-Brucker Toles.....  which means 4... http://t.co/KpRSJKJXzJ
641465337360289000,positive,Not Available
641468343342514000,neutral,"Paula first plans 2 shoot 1st vid w Leo. Madonna advises 2 begin with a solo. ""Babydoll"" is shot b4 ""Showgirls"" http://t.co/PlBV8mz0HO"
641469648677027000,positive,Warning: prepare for many Madonna tweets tomorrow since it will be the opening night of the #RebelHeartTour #whosthatgirl
641479883730714000,positive,@heather_chorn @RebelCiccone I going on the 9th hope to find it hope you guys to good luck to all of us Madonna fans
641482474174984000,positive,This is the 1st @Madonna tour that I've had Madonna tattoos for! Wonder why it was #RebelHeart to make this happen? #RebelHeartTour
641489396970029000,positive,@jsethriley Great what a cutie and it was nice to see your face on there omg Madonna coming back on stage 1st time I am on the internet
641502059078946000,positive,Not Available
641508814341074000,positive,"@Mahdouch_m @musicnews_shade in Madonna's 7th year, she earned $125million. Back then it was really expensive. http://t.co/vnBYZiI7JO"
641529631615680000,positive,A break from all the disasters around the world... Can't wait to see Madonna on Sat and be a teenager again. http://t.co/X1ntfJe3KR
641555369286832000,negative,@shockadelicaa Just until the 17th or some shit. I don't want to see Madonna spoilers.
641613817059876000,neutral,"depending on how late Madonna goes on stage tonight, I may consider thinking about getting a ticket for Sat. night.  maybe.  #notreally"
641645675353014000,positive,@JTennis95 Totally called it! Bitch I'm Madonna is the 2nd song.
622462883994161000,positive,(18 July) The last films of the evening are Ant-Man (12A) and Magic Mike XXL (15). Both films start 8pm sharp.
622515915595366000,positive,Going to see Magic Mike XXL may be the single best decision I have ever made in my life.
622546592600596000,positive,@channingtatum In theater to see Magic Mike XXL for the 3rd times. Love this movie.
622580048038596000,positive,Sunday's heating up like it's summer all over again. Make #MattBomer your Sundate with MAGIC MIKE XXL - now... http://t.co/TU51t3Xs2T
622582169345634000,positive,Seeing Magic Mike XXL with my mains last Friday! #fridayfunday #unforgettable #tgifholiday https://t.co/4QErLEKSeK
622715323423133000,positive,I may not seem like the target demographic but let me tell u that I think Magic Mike XXL is one of the most excellent pieces of film making
622730312175390000,positive,"Magic Mike XXL is better than the 1st. I learned a lot about the male stripper psyche &amp; culture (&amp; midlife crisis), &amp; female sexual desire."
622775200149569000,positive,"Yes, Magic Mike XXL is a feminist movie, but the reason may surprise you http://t.co/3r5JTNDLMa"
622909601139200000,positive,A FB friend of mine just posted that seeing Magic Mike XXL was the best night of her life. If only she knew what my typical sat night is.
622998426943422000,positive,What is this force that compels me to keep watching Magic Mike XXL? Saw it the 2nd time yesterday and am already ready to see it again.
623018843489857000,positive,"Also, ace time with the uni ladies. Saturday in Stonehaven, barbeque, Magic Mike XXL, tons of food... hips hurt from all the walking though!"
623132683506352000,negative,"Mama: Shoti, i bought 2 tickets to a movie, the title is MAGIC MIKE XXL i don't know why is that the but watch it with me tomorrow. Me:....."
623200363387224000,positive,I want Magic Mike XXL!!  C'mon? ;)  #hoorayformonday #workwork #nachos #lavinia #novaturient
623316890996248000,positive,Magic Mike XXL on a Monday night...was everything I expected it to be.
623322358829297000,neutral,So Magic Mike XXL is out of theaters as of last Friday in the Bahamas. A whopping three weeks to the day of release.
623328721244684000,positive,"""3rd times a charm"" -@KamrynjGunnes after seeing Magic Mike XXL for the third time"
623428903189782000,positive,Hey @ElectricCinema how about august electric scream screening of magic mike xxl?? Mamas def want to see some dancing and comedy!
623476592812163000,positive,Woop! Can't wait to see Magic Mike XXL this Friday with the girls @KLB1710 @LaurenNatalie
623493553122082000,neutral,"To make room for the new movies, MAGIC MIKE XXL's last showing is WEDS. THE GALLOWS, INSIDE OUT, &amp; JURASSIC WORLD's last showings are THURS."
623703521733390000,negative,B texted me and told me that she &amp; her mom went to see Magic Mike XXL (she loved the 1st one) and she hated it.
623708530831331000,positive,"Going to bed, can't wait to see for myself the ""anti-hetero male campaign"" that Magic Mike XXL is apparently leading tomorrow.  Goodnight!"
623741601534210000,positive,Here he comes ladies.... Magic Mike XXL will be getting it all off TOMORROW night for the Otautau Plunket... http://t.co/Wu4NJ1cimw
623814061096984000,negative,Not Available
623845531421380000,positive,"Lol just spent an hour talking to my mum about Magic Mike XXL. I was s'posed to work today &amp; take tomorrow off, but meh I'm gonna reverse it"
623901546158379000,neutral,"I have surgery inside my face tomorrow, so stockpiling good feelings by going to the cinema with @RossalynWarren to see Magic Mike XXL.   A+"
623975982181945000,positive,I'm taking my women's networking group to see Magic Mike XXL tomorrow and many of them are over 60 so this is going to be a good time.
624164885384007000,positive,"3rd viewing of Magic Mike XXL tonight. What a time to be alive, to have this chance, to live my best life."
624393060252696000,neutral,Who will go see Magic Mike Xxl with me before I leave on the 31st???
624401907918970000,neutral,sister accidentally saw Magic Mike XXL with our mom &amp; wont take a break from texting how horrified she was to say how it compares to the 1st
624419598658600000,positive,Dear all people I know who are attracted to men:  Go see Magic Mike XXL.  Fair warning - you may fall madly in love with Matt Bomer. *swoon*
624513503655784000,positive,"Whoever took their baby to the 7pm Friday screening of Magic Mike XXL, you're my hero."
624697156230889000,negative,Magic Mike XXL is probably the single cringiest film I've ever sat through at the cinema.
624764838212861000,positive,Magic Mike XXL was the perfect warm up for tomorrow night's entertainment.
624825126576484000,positive,@pootriarch @frolicandetour I approve (not of the rough day. May I recommend a viewing of Magic Mike XXL to cheer you up?)
624964022257913000,positive,I think sitting on the very 1st row watching Magic Mike XXL was the BEST idea ever...
625009089722974000,positive,May or may not be going to see Magic Mike XXL for the second time tonight &gt;.&gt; #noshame
625111128708792000,positive,Magic Mike XXL is so muj better than the 1st one lol
625148177100902000,neutral,10k on the Feminism of Magic Mike XXL due on my desk tomorrow.
625322593160175000,positive,I'm going to see magic Mike xxl (I think that's what it's called) this Tuesday with two friends (it's a movie with Channing Tatum &lt;3)
625418032106618000,positive,Not Available
625463703987724000,positive,I hadn't seen @bejohnce cry until today at our 5pm showing of Magic Mike XXL (was my 3rd time seeing it &amp; I would again)
625473293810835000,positive,Not Available
625606066240401000,neutral,@sabinasmitham nobody wants to see you panting in the shadows over Magic Mike XXL at 2pm on a Monday.
625760666968805000,positive,Not Available
625767567521505000,positive,Not Available
626072997087068000,positive,Goddess bless the Sisterhood of Seeing Magic Mike XXL Alone at 1:00pm on Tuesday.
626270491888721000,positive,"Going 2 see Magic Mike XXL for the 4th time tomorrow!  After watching this scene, no explanations needed, GOOD NITE! https://t.co/MJcwfZtocA"
626320286594560000,positive,A select person keeps reblogging certain set pieces from Magic Mike XXL onto my tumblr dash. Sis. SISTER. May God bless and keep you.
626441817509072000,positive,@HeyAnnieMok @ourobora We saw Magic Mike XXL on a Tuesday night after eating Vietnamese sandwiches and gossiping about comics things!
626611558009843000,positive,Magic Mike XXL was even better the 2nd time
626614469452505000,positive,I have to say the Pony scene from Magic Mike XXL may be some of Channing's finest dancing
626723970314862000,positive,Living for Magic Mike XXL with @foxyhedgehog tomorrow.
626815401242963000,positive,"I may be the last human on Earth to see Magic Mike XXL, but tonight it's happening."
627004854850842000,positive,'Magic Mike XXL' and the pursuit of pleasure - The Daily Collegian ...:  http://t.co/FtJ9whIWki #BackstreetBoys
627040472746168000,positive,"My weekend plans: Play Fallout 3, see Magic Mike XXL with my sister &amp; D&amp;D on Sunday. What are everyone else's plans?"
627147203614744000,positive,July 31- Aug 2: MAX (PG) &amp; MAGIC MIKE XXL (R) Mark your calendar now for the Labor Day weekend Dbl Dusk-to-Dawn. You won't want to miss it!
627193525218770000,positive,Magic Mike XXL is going to be hilarious tomorrow @BeethCX
627348725036285000,positive,I think I'll go watch Magic Mike XXL at the theatre again tomorrow. I'm in that kind of mood. I need me some male stripper action!
627708805313212000,positive,Magic Mike XXL may be my favorite movie of the summer. I was smiling and laughing the entire time.
627762044003991000,positive,You bet your bottom dollar I saw Magic Mike XXL for the 2nd time tonight and loved every minute of it
627979005317091000,positive,"Busy week. Tues - Love and Information @SydneyTheatreCo, Wed - Ghost Stories @SydOperaHouse, Thurs - Matilda, and tonight MAGIC MIKE XXL!"
628042502654660000,positive,"Sunday funday is lunch and Magic Mike XXL with the ladies, then swimming! #Channingishot #gimme"
628327427392020000,positive,"Burgers, ales, wine, Magic Mike XXL. Way to make Monday bearable. #magicmikexxl"
628494427292504000,positive,#Abs! #Dancing! #Dudes! Get along to MAGIC MIKE XXL at the @ANUFG this Thursday at 7.30pm http://t.co/Kutar5fSIQ
628882024586190000,positive,"So Magic Mike with @jack_l_smith was super great. Tomorrow I'm going to see Mission Impossible, but all I wanna do is watch Magic Mike XXL."
628904617099669000,positive,Not Available
629120912374296000,positive,Ladies night out! On August 12th Wiley's is hosting a Male Revue with members of the new Magic Mike XXL! Watch... http://t.co/NwzCYWS4vS
629345294266859000,positive,"For the ladies, because #Thursday. Donald Glover in Magic Mike XXL. Tasty. http://t.co/rB7fQqsx5j"
629764521561849000,positive,Bit late to the party but just back from Magic Mike XXL and ermahgaaad I could have sat in that cinema for the rest of my life. Nom nom nom.
629819019026010000,positive,Nothing better than listening to the Magic Mike XXL soundtrack on a Saturday @hannahmooneynz #ChanningSwag #DemBeats
629954659097014000,neutral,Sitting at home on a Saturday night watching Magic Mike XXL in bed with my dog and a pizza box wondering why I'm still single.
630273340133937000,positive,@lindsaydemeola HAPPY BIRTHDAY GORGEOUS!!!!!! May you day be more magical than the movie Magic Mike XXL. :p
631911895763689000,neutral,Would it be wrong to watch Magic Mike XXL for a 2nd time?
632145459637821000,neutral,@guardianfilm I think they may have used up all the sexy earlier in the summer with MAGIC MIKE XXL
632240200056369000,negative,One of my Magic Mike XXL co-workers and the coordinator of the premiere I went to on June 30 this year died... http://t.co/MsYMeianAw
633094920014839000,positive,@boybandbabe04 then you may like the Magic Mike XXL soundtrack
633463250563280000,positive,New movies starting Fri:  1. How to make Love Like an Englishman.  2. Magic Mike XXL.  #movies  #Montreal
633899276314279000,positive,"Magic Mike XXL comes out on DVD in October , so someone has to buy it as a birthday present for me lol"
634171544298721000,positive,"@wackyhistorian Andi does! She's also seen Magic Mike XXL like 6 times though, so you may just have to be your own judge"
635610705761275000,positive,So I get to go see the Magic Mike XXL live show this Friday.. I'm in heaven
636305411918860000,positive,This Friday! We are showing the film Magic Mike XXL in Chem 140 for FREE at 8 PM! http://t.co/5Sl8BTIDW8
636400724021121000,positive,We have an encore screening of Magic Mike XXL this Thursday at 1 pm at Rainbow Cinemas! You don't want to miss... http://t.co/nL7xPJIO7Y
636572711674884000,positive,@dtwps prolly not - Magic Mike XXL comes out on September 15th and that's gonna keep me hetero through the holidays LOL
637198427487518000,neutral,@bcrops fell asleep during Magic Mike XXL.....guess we are just gonna have to rewatch it tomorrow.....daaaarn
637265887238578000,positive,The Modern Family star and her Magic Mike XXL hunk are said to be tying the knot in November.
637381848348409000,positive,Magic Mike XXL....wellll boyyyyyy....it was way better than the 1st
637740713610887000,positive,Barely watching Magic Mike XXL for the 2nd time.
638068508451061000,positive,London. Spent the afternoon with friends in Soho hotel enjoying our time together! Sunday cinema: Magic Mike XXL: OMG http://t.co/kamsOtVoAW
638120614549520000,positive,"So, I may have disturbed some of the other filmgoers at MAGIC MIKE XXL when I squealed just a bit at @TheVickyVox's scene."
638121330840346000,positive,"Cineplex is doing Tuesday prices every day until September 4, someone come with me to see Magic Mike XXL?????"
638127140534226000,positive,"Dollar Theatre  It's Sunday night, what else am I gonna do? Anyone wanna see Magic Mike XXL with me?  Ha!"
638168995271737000,negative,"I was SO disappointed with Magic Mike XXL!!! If it would have came out first, I dont think I would have watched the 2nd one."
638339164145123000,positive,"Attention, Queens. I finally found a good copy of Magic Mike XXL so I will be watching it a 3rd and 4th time with whoever hasn't seen it yet"
638621595624312000,positive,@channingtatumsaw Magic Mike XXL. 4th time. If you think it's just about stripping.....you would be wrong.....#YOURbeautyisenough
638829173469900000,positive,"Yep, it's happening! Come watch Magic Mike XXL this Friday at 7pm and start your Labor Weekend off right! http://t.co/TzFSm4oTQp"
639184399062294000,positive,@the_hoyk Magic Mike XXL is still playing the awesome Simi Valley 10 bargain house but the run ends Thursday: http://t.co/oql0jmpUjd
639243526539227000,positive,@GriffLightning In the spirit of sharing: 1. WORLD OF TOMORROW 2. MAD MAX: FURY ROAD 3. TANGERINE 4. MAGIC MIKE XXL 5. BUZZARD 6. EX MACHINA
639482744179822000,positive,I'm rewatching the Cheetos and Water part from Magic Mike XXL for the 3rd time lol
640743490196893000,positive,Im mind blown after watching Magic Mike XXL for the 1st time
641069286371430000,positive,bout to watch magic Mike XXL for the 5th time
629422725996630000,positive,Mariah Carey Celebrates Her Star with Beacher's Madhouse's Jeff Beacher! http://t.co/hg2mnTkUPq via @JustJared
629486615396683000,positive,"So I'm on the juke box at the flats and I decided to play ""all I want for Christmas"" by Mariah Carey It's August.Let's see how this one goes"
629650159299751000,neutral,"For sure just Missed my exit because was singing to Mariah Carey way too full out. Happy Friday, all."
