Item Id,Sentiment,Tweet
636764945896443000,negative,"Prochoice #UniteBlue Planned Parenthood's Foggy Evil: On Tuesday, the Center for Medical Pr... http://t.co/uBWmSrHgMo #PlannedParenthood"
636925087355170000,neutral,Govt-shutdown caucus may not be ready to go to the mattresses over Planned Parenthood. https://t.co/PwanXq5TKG
636965183814893000,neutral,Texas will defund cancer screenings at Planned Parenthood starting September 1. Here's what the media needs to know: http://t.co/tztQEzB8wq
637038773562269000,negative,"Planned parenthood, Joseph Mengele, and Adolf Hitler salute you. You've done well for the 3rd Reich."
637051662029463000,negative,"@OliveTulips @tedcruz Nice Try - but why do you #LIE! (#Obama lies2) ""Planned Parenthood does not provide mammograms"" http://t.co/VKktof9WXJ"
637086073299050000,positive,So that we may spend eternity with Him in Heaven . Planned Parenthood must be shut down Violence begets Violence . Respect ALL LIVES
637258001510961000,neutral,Do you live near York? Come stand with Planned Parenthood next Thursday -- details here http://t.co/BggGlI5kUf http://t.co/ulViTjc09N
637305388216524000,negative,It would be refreshing for CNN to give as much attention to the monsters at Planned Parenthood as you are to a panda https://t.co/16C8BebIpB
637320036248592000,negative,Planned Parenthood to give out free handguns with all abortions effective September 1st.
637328456963850000,positive,"""They all want to defund Planned Parenthood.""  Thank God for that. https://t.co/YombU1SJls"
637351806247522000,neutral,(Reuters) - Planned Parenthood filed a complaint in Alabama federal on Friday seeking to stop the state from defunding its health cli...
637388683004407000,neutral,"Jindal's claim that Planned Parenthood can't sue may not hold up, experts say http://t.co/35GXrYJVsg | Because he has a LAW DEGREE?@#$%! #p2"
637404977707794000,negative,Catching up on Sunday NYTimes: 1st thing Bobby Jindal is going to do as president is invade Planned Parenthood lol.
637529124924321000,negative,"@delphinium83 1/20th the pay of a typical CEO, nice.  Planned Parenthood still a non-profit.  Appendectomies kill appendixes."
637565014338076000,negative,@BarackObama is the 1st to call a Black man a NIGGAZ &amp; Call Black Women BITCHES. Why? He SUPPORTS Planned Parenthood. http://t.co/MPss7ucXfS
637641239999942000,positive,Join us at the Stand with Planned Parenthood rally in York next Thursday! RSVP here now: http://t.co/N1rGBGVfg0
637658691651682000,negative,.@tedcruz comes out swinging at Planned Parenthood re videos. Says on 1st day in office he wld instruct DOJ to investigate @PPact.
637705802095194000,negative,Planned Parenthood admits it manipulates rules on fetal organ sales to maximize profit - Washington Times http://t.co/t9QC4TgYxt
638053408965021000,negative,"""investigative video reveals Planned Parenthood may be committing infanticide, babies born alive, murdered, and sold."" ACLJ ""with child"" KJV"
638344432245276000,neutral,Planned Parenthood fight and the Fed: The Fed may want to get ahead of policy risks and increase interest rate... http://t.co/ojQGU7Qe87
638389003151110000,negative,"Planned Parenthood VP Says Fetuses May Come Out Intact, Agrees Payments Specific to the Specimen http://t.co/ZNls2HVGwz via @GulagBound"
638451699452149000,negative,"You may try to suffer for there is cast into the Planned Parenthood facility in your gifts, you are above every decision is at work for p..."
638470381209174000,negative,On Sunday morning Pastor Rob McCoy addressed the atrocity of Planned Parenthood and their selling of baby body... http://t.co/g5mA0378EE
638479211263463000,negative,"If you are still wondering what laws have been broken by Planned Parenthood, read CMP's open letter. #defundPP https://t.co/PuJszdAyCp"
638519370902294000,neutral,".@RubenKihuen also didn't budge on backing Planned Parenthood, came out for boots on the ground to defeat ISIS. Back to 5:30 everywhere Fri."
638640331299405000,negative,@SquerbSocial He's calling out the slime in D.C I don't like his support of Planned Parenthood.. I think he's tax plan may be lax..
638760832822734000,negative,"Prolifers held a large rally in Petoskey on Saturday. They were protesting Planned Parenthood, the nation's... http://t.co/sdZB7LZkbw"
638768064427855000,negative,"If it weren't for Christians, the Aztecs would never have stopped killing babies (like Planned Parenthood does.) https://t.co/PhRTVJIldR"
638856131004243000,neutral,ICYMI: Heres what you must know about Texas' decision to defund cancer screenings @ Planned Parenthood on Sept 1  http://t.co/9itHwYhB9a
638904223212642000,positive,@ShannonBream  @FoxNews I will be watching Friday night at 10 est your special report on the Planned Parenthood scandal @CWforA
638904316288327000,negative,"Love my @NRO, but 1st item under The Week in 8/24 issue about Planned Parenthood scandal was beneath you. I expect a little more, friends."
638904475038654000,negative,"Ninth Shocking Video: One ""Just Fell Out"" of the Womb. Time to prosecute Planned Parenthood! http://t.co/Q3fJx60nO8"
638931125428219000,negative,Not Available
638961808284479000,negative,Missouri Health Dept May be Allowing Planned Parenthood to Break the Law to Do Abortions http://t.co/s0S8f7ecUF
639051256133255000,negative,"Planned Parenthood Sells Intact Aborted Babies, One ""Just Fell Out"" of the Womb http://t.co/6ApZwGugHA"
639055108936830000,negative,'It just fell out of the womb': 9th sting video shows how Planned Parenthood easily gets intact foetuses from ... http://t.co/02mcvRi91h
639118270843387000,negative,"""Late on Monday, the Obama administration filed a so-called statement of interest at the court in support of Planned Parenthood. """
639213159589507000,negative,The future must not belong to the butchers of Planned Parenthood! 9th video http://t.co/P36CTMMnIQ via @wordpressdotcom
639234396814508000,positive,"RandPaul: Tune in to Fox News Friday night for a special on Planned Parenthood, brought to you by ShannonBream! http://t.co/pfv2aHx7LV"
639240002665320000,negative,"just because ""the media"" won't say anything about it, Planned Parenthood's still doing its thrifty genocidal thing: http://t.co/00Yx9RvPfY"
639315054249279000,neutral,@JosephRemiB @laura_lrnzo @amarquis32 They follow up at 10pm Friday with a FOX News Reporting going after Planned Parenthood.
639404336506732000,neutral,.@ShannonBream anchoring @FoxNews special on the Planned Parenthood swirl tomorrow night. talk with her today at 10. http://t.co/DGYd6bCOzR
639422350056775000,negative,STOP THE SLANDER AND LIES ABOUT PLANNED PARENTHOOD!! Arizona at Work is on the air Thursday 12-1pm MST (AZ time)... http://t.co/SFwzm1aGGG
639443548987912000,neutral,Thank you @FoxNews for producing a special on the Planned Parenthood fetal body part scandal to be aired tomorrow night. #PPSellsBabyParts
639451102291886000,negative,"1st he disallows use of Global Warming, now-&gt;Governor's office scrubs press release on Planned Parenthood http://t.co/nSy4JktYhg via @maddow"
639544264226029000,positive,Hoping your tweet means u realize the importance of Planned Parenthood in early cancer screening for women. Do you?  https://t.co/OBvMjworom
639591078882971000,neutral,"Tomorrow I'll respond to the often-repeated ""Abortions are only 3% of what Planned Parenthood does!"" http://t.co/hSqO6LzhKc #ProtestPP"
639592214868262000,negative,Satan worshipers align with Planned Parenthood to defend the practice of chopping up babies for profit http://t.co/vrhE95ZLJ9
639648980847198000,negative,An expose on what is REALLY going on at Planned Parenthood. See for yourself Friday at 10 pm PST on FoxNews https://t.co/EmmLDXvSlL
639775480812408000,negative,Please!!! Watch Fox News 9pm central tonight (Friday) to see what Planned Parenthood is doing with with Millions of our  tax dollars.
639791469293912000,negative,"Sure, they did. How heinous and barbaric, and yet, the democrats stand with PLanned Parenthood rather than BABIES! https://t.co/1rSoqYWVpL"
639822276595068000,negative,"Everytime my mom calls me I answer with ""Thank you for calling Planned Parenthood, this is Karen how may I help you abort your child today?"""
639883122352500000,neutral,A federal terrorism task force is investigating the fire at Planned Parenthood in Pullman http://t.co/pCjKQIpJmi
639890066291195000,negative,"""America's Killing Factory"" A look behind the walls of Planned Parenthood.  Coming Monday September 14th @ 9pm  http://t.co/QczY5Y5a5Z"
639890137460146000,negative,@FoxNews get the facts on Planned Parenthood from the conservative media? I didn't know it was funny Friday.
640123333070200000,negative,"""The fire may keep the clinic closed a month or more, Planned Parenthood spokeswoman..org looking for a temp office""  Devil's hate fire  @AP"
640177056119169000,neutral,"Every Sat I pass people protesting Planned Parenthood on my way to work, &amp; it makes me determined to donate more to them every fucking time!"
640188972551897000,negative,There are no suspects yet in the arson fire at the Planned Parenthood building in Pullman. It was ruled arson after an investigation Friday.
640281963920658000,negative,"If you're dumb enough to believe the Planned Parenthood sting videos, you are complicit in burning an office http://t.co/ifN31B9l3k"
640304774697586000,negative,Not Available
640540480007241000,negative,Democrats will say #BlackLivesMatter as they march you right up to the doorstep of Planned Parenthood. http://t.co/NrOXWR9bL9
640594355649146000,negative,"PLANNED PARENTHOOD is the focus of something others like say maybe church based hospitals may be doing , the market did not birth with them"
640774497075863000,neutral,PolitiFact Sheet: 8 things to know about the Planned Parenthood controversy http://t.co/QbbsS6r2Lo via @PolitiFact
641267197667639000,negative,"MT @RepGosar: My 1st read of the day from @FoxNews: Congress returns to tight deadlines, key farts on Iran deal, Planned Parenthood"
641304720326328000,positive,"Planned Parenthood Continues to Stand Strong by Meagan Gallagher On July 14, a group calling itself the Centers... http://t.co/OCLBflZ7Kz"
641328490432884000,neutral,"You can tell Joy Behar is back on the view,defending Planned Parenthood,saying only 3% of their business is abortion related,c'mon man!"
641356738369708000,neutral,"Going to shut the gov't down over Planned Parenthood, Tom? https://t.co/h6YKYLOdPY"
641367336553984000,neutral,"What's behind the attacks on Planned Parenthood? NEW SHOW Thurs 9-10pm @WBAI Sunsara Taylor, SisterSong statement, more @4womenslib @ssedoga"
641450656583127000,neutral,Going to Planned Parenthood on Monday because 1.) I haven't gotten a basic physical in two years 2.) I am writing a piece on it for Affinity
641581327435866000,neutral,"The U.S. Justice Department sided with Planned Parenthood in its court battle with Louisiana Gov. Bobby Jindal (R) Monday night, telling a"
641587685942009000,negative,Congress will hold its first hearing on the Planned Parenthood controversy. Guess who wasn't invited to testify? http://t.co/kvkcKs3AcS
641617694652006000,negative,"While not fantastic for Planned Parenthood, those calling for defunding arent being honest about deceptive videos. http://t.co/pf2PltXmA6"
641625870763999000,negative,LIVE: I'm at @HouseJudiciary's 1st hearing on the callous videos of Planned Parenthood's alleged abortion practices http://t.co/lAxACKVYwN
641635092570488000,negative,That awkward moment when the GOP puts Planned Parenthhod on trial without letting Planned Parenthood defend itself http://t.co/jO5Wmxbazz
641669938588086000,negative,@TGowdySC may God bless you in your fight against Planned Parenthood! Shutting down government would make sure women never get healthcare
641138999617187000,positive,"Seriously, reminder that the Pope is no figurehead.  He is the leader of the Catholic Church.  He has real power, limited though it may be."
641150602240593000,neutral,DAILY POST: POPE reveals why he likes UHURU so much! See what he told WAMALWA! OBAMA may faint http://t.co/JfqHPgxwwM
641156889666035000,negative,Even the Pope thinks Cameron is a douche https://t.co/ACbeo0eGkj
641162416139558000,negative,"The pope is being a bae again, but I feel like the Catholic church could be giving more to relevant charities. https://t.co/QW532U0ddP"
641171086944694000,negative,Even when the Pope says something nice he is saying something rotten. https://t.co/BifgNJvayK
641173711148744000,neutral,Cross Wires Tuesday headlines: Pope's Motu Proprio changes the way Catholics get annulments; Catholic parishes... http://t.co/DQk7lfwlim
641176871145635000,negative,"Hey @TonyAbbottMHR, the Pope missed your communique on just looking after the Christians.  https://t.co/gDLUTXe6B2"
641184028490645000,positive,"Love the combination of pics here: Pope at the gate, about to be released into the wild...? https://t.co/azBEmAnF8E"
641188082625044000,neutral,The Pope and Mussolini: The Secret History of Pius XI and the Rise of Fascism in Europe review | Books | The Guardian http://t.co/FGe6kuSjcd
641205630599057000,neutral,Good Tuesday morning. Big news out of the Vatican:  Pope radically reforms Catholic Church's process for annulling marriages. @GMA
641210593794465000,negative,"@RealJamesWoods in similarly shocking news, the sun is hot and the Pope is Catholic. Can't believe there is anyone who trusts this woman."
641211344524460000,neutral,"Beginning today at noon., 10,000 tickets will be available to the public for the Pope's event on Saturday,... http://t.co/WWuJO6GpII"
641213495422259000,neutral,( #TeamVillanosFDL ) Pope to make annulment changes: Pope Francis is expected to announce revisions on Tuesday... http://t.co/5yFUk0sz40
641216724180709000,positive,Tickets to see the Pope go on sale today at noon.  The rest go on sale tomorrow.  Here's the link and all the info: http://t.co/KA8KG8nTG8
641227698111574000,positive,"This radical Pope is close to getting excommunicated ;) May the Force be with you always, @Pontifex.  https://t.co/mWJGbDAMU7"
641230963444465000,positive,@TheLocalEurope @Fjordman1 DE LABORE SOLIS = He is the last Pope for the Prophecy ! The Sun &amp; OUR Gods come back ! http://t.co/I0pqBtp4ek
641231945121185000,positive,[KCCI] Pope changes annulment process for divorced: Pope Francis on Tuesday radically reformed the process by ... http://t.co/iNMvrlzZw6
641234323245412000,neutral,"obama &amp; the pope are everywhere. theyre getting everyone accustomed to seeing their faces everywhere. when sunday law comes, it'll be normal"
641236186057474000,positive,Not Available
641236215866490000,neutral,"@Zoraidasambolin Life long Catholic but some of rules nonsensical.  Remember Venial sin, no meat on Friday's? So I don't worry about Pope."
641238799599706000,negative,"@DennisDMZ   And now the Pope who has forgiven annulments.   I think his words were ""fuck and be fucked""   I may have translated that wrong."
641240062118756000,positive,"December 8 begins the Pope's ""year of mercy""."
641242251612549000,negative,Not Available
641249773928980000,positive,This pope is so cool I may just remake my MySpace so I can add him to my top 8
641250877391695000,negative,Anyone else feel like Cool Pope may be in jeopardy of going down Julius Caesar-style?
641250940218142000,neutral,@TwickMuseum We understand that the site should reopen next Tues. Pope's Urn will be officially launched by Lord True on Mon 21 Sept
641252712194179000,positive,Families take in refugees as Pope calls on Europe's churches to open their doors - http://t.co/Qi8Gsgq7HX 1st X I disagree with his Holiness
641253026188144000,negative,Are they closing all schools 4 the Pope visit or the Million man march anniversary???? Foolishness. ...
641257580455665000,positive,"C'mon, do you wanna popular pope or a strong spiritual leader? Popularity and the Pope http://t.co/WB9s7qOiIK #catholic #popefrancis"
641258093393768000,negative,Not Available
641261535067770000,neutral,"@Reuters The Pope may get applause, but it is actually another e.g. of the church being pulled along by modernity. Still a long way to go."
641266192057896000,neutral,"Pope simplifies Catholic marriage annulment: Pope Francis, making the most substantial changes to Catholic mar... http://t.co/puSOEsVGzB"
641267403813449000,neutral,@SEPTA_SOCIAL Re Pope: is it possible to take MFL from 2nd to 34th on MORNING of MONDAY Sept 28? When does MFL resume regular sched/stops?
641271370664443000,positive,"Join the Moral March in Washington, DC on September 24: On September 24, Pope Francis will address Congress on... http://t.co/QfyWQ5ys2X"
641283483713728000,neutral,Tried to get Pope tickets but it sold out hotter than any concert!  Will try tomorrow at noon!
641287967521263000,neutral,The Pope Wants To Make Annulling a Marriage Easier - Pope Francis on Tuesday revolutionized the procedure for Roma... http://t.co/x166DJP8Tj
641295790481231000,negative,It was just a matter of time. This Pope's day may be numbered as head of church -&gt; Conservative dissent is (cont) http://t.co/eEdlaePs3E
641298193871843000,neutral,Pope radically simplifies Catholic marriage annulment procedures: VATICAN CITY (Reuters) - Pope Francis on Tuesday made it simpler an...
641304560162709000,positive,@heatherw25 I just hope the You Only Pope Once pale ale doesn't go quite as fast in Cape May that weekend
641308763308335000,neutral,#World: Pope's faster annulment plan may mean less in U.S.: Pope Francis has just reformed t... http://t.co/8P7Fb9mtfY via .@TheNewsHype
641312094567186000,neutral,@RorateCaeli @ProtectthePope Thanks 'pope' Francis for quickie divorce VII style. 2nd Council + Novus Ordo the work of Masonic infiltrators
641312870786035000,neutral,Its been a hard days fishing  today my 1st fish a ruffe a good start I thought I'd been blessed by the pope! http://t.co/tucMpVm20U
641314853756510000,positive,@RichardJonatha call Hafiz saeed sir he may help u out. Maybe Pope can b handy . Try it.
641317664384786000,positive,"Celebrating the Pope: What Makes Pope Francis Tick? FREE webinar: Sept 10, 7-8p EDT More info: http://t.co/awgzJYMTz7 @MattBunson presents"
641323092208431000,positive,"As a Jesuit Pope visits the US, you may have questions about us. Check out the US and Canada Jesuits' resource page: http://t.co/dkw27zY531"
641329554120908000,neutral,Pope Addresses Portugal's Bishops on 5-Yearly Visit: Pope Francis on Monday received in audience the bishops o... http://t.co/vL5T2T9Z1E
641330968587059000,neutral,Question!!!!!! Somebody settle this for me.....  when the pope comes in town the weekend of the 25th of... http://t.co/6DNTE0xjaL
641331355687755000,positive,The Pope is only as nice as he has to be to lure you back in: Cool Pope strikes again: Pope Francis on Tuesday... http://t.co/ALybE0Tl8K
641332059328397000,positive,"Pope Francis USA tshirts on sale for $10 to Mr. Hylka-room 219 by Thursday 3pm. These will be worn 9/23, the day the pope arrives in the US."
641340308190400000,neutral,I wish the Pope would do ANYTHING other than canonize Serra when he visits my school on the 23rd.  I really like... http://t.co/U9LcnM7dCS
641345098681225000,positive,"Looks like I have a 1/3 shot at getting tickets to the Pope's Mass. So if anyone isn't busy at 12EST tomorrow, I'd appreciate some help."
641346625059729000,positive,"Pope Benedict XVI 1st to quit in about 600 yrs, feared a bad pope would be chosen.  http://t.co/Qtvmr4xNcc https://t.co/asrPlVYydb"
641352993003012000,positive,Hey everyone go vote so the POPE vs Woodstock game can be shown live on TV on Friday!           http://t.co/eaAPxLtYRr
641359485349441000,positive,"Went on a tour of the Basilica, where Michelangelo was buried. Going to the Sistine Chapel tomorrow. Pope is speaking there."
641359984568078000,negative,It was a Disrespectful Travestys for POTUS to send 2 Pro-Aborts (Pelosi &amp; Biden) to the Pope's Installation! https://t.co/a9ivhV29eV
641363235308900000,positive,Not Available
641364803819188000,positive,Not Available
641368717570494000,positive,I am glad the Sanhedrin is back in business (because of the 3rd Temple) and will be trying Obama and the Pope in absentia Well deserved.
641379710006611000,positive,"If you missed out on Pope tix for Independence Hall,just annnounced 2 more tix avails online 4&amp;8pm Wed @fox29philly http://t.co/FOYiCO4hQg"
641386039983128000,positive,LADY TECNIQ NEWS A Quick Pope Primer: Things to Know Before His Historic Visit to the United States Later This Mon... http://t.co/jRh7bG0zbL
641407191161765000,neutral,Pope's faster annulment plan may not mean as much in the US. http://t.co/JQT2PL2GNg @Pontifex
641408123404709000,positive,Today the Pope announced making it easy to get an annulment. Coincidence that today is my 25th wedding anniversary? #omen #wtf #SignFromGod
641412525930713000,neutral,Sen. Schumer to announce Wednesday the winners of tickets to see Pope http://t.co/aoZ17ZBgOq
641415505509773000,positive,WISCTV_News3: Pope's marriage annulment changes expected to make church more inclusive #news3  http://t.co/f7uPXynC7q
641416305460027000,positive,Not Available
641423528252821000,positive,Not Available
641430091621265000,neutral,Not Available
641433386221830000,positive,We just had a great time with Joyce Coronel with The Catholic Sun.  She interviewed several families who are going to see the Pope.
641436136515112000,neutral,What's going on? Tickets for pope Mass available Wednesday - The News Journal http://t.co/nuBKBMFBFY Get found -&gt; http://t.co/nbAPjWTaKw
641436903053488000,neutral,Not Available
641439816933093000,positive,"""I wonder if the Pope watches our games"" - @joeschmidtiv may be the quote of the season"
641440505943998000,neutral,My Jesuit university sent out an email saying the Pope will be giving mass at Madison Square Garden on September 26th. Starts at 6:30
641448032014336000,neutral,@jimmykimmel @RitaOra @chrisbrown so you balance out an American hero with a  woman beater? Who's on tomorrow the pope and O.J?
641475702513102000,neutral,Is the Pope a Catholic? Do they drive PU trucks in Alberta? https://t.co/8MtvAP9FIl
641499788291108000,neutral,Not Available
641504331305455000,positive,"Religion's power is not in becoming more like you but in showing you an ideal to copy. So while many may like the pope's changes,as an (1/2)"
641511801696464000,neutral,"@AnGeLiTaHpsycho @jillkentok The Pope is way advanced than the century self, he's probably in 23rd LMAO"
641512160649019000,neutral,"Pope says marriage annulment should be free, new rules may mean marriages can be annulled in just 45 days in some cases."
641541239666442000,positive,@tousledlwt so the pope visit the philippines somewhere in january
641552481403674000,positive,"@bertyashley @RichardDawkins Better call the Pope. He may be more sympathetic, one never knows."
641557033238556000,positive,Hope the Pope heard about it  https://t.co/scTGFNmR8L
641562494461456000,positive,"September 23 , CERN, Pope meets congress for the first time ever.. Y'all betta wake up.. It's bout to go down ..... http://t.co/ZSyFuidu8F"
641578663096401000,positive,The Pope is coming &amp; our 1st graders are learning about his travels with Flat Francis! Mrs. Donohue you're awesome! http://t.co/s3QoI1TuOe
641579926215266000,positive,Serbian President to Visit Pope Francis on Friday: Serbian President Tomislav Nikolic will meet with Pope Fran... http://t.co/sUNcLqpIx9
641581847084957000,negative,@Michael_Nutter like how are ppl supposed to pay rent? Should i ask the pope on the 26th when he comes?
641605895873363000,positive,Focus on Faith and Climate Change: Pope Francis &amp; the 4th era of the Catholic Church's engagement w/science http://t.co/jWS4qnnTbU Premium
641609830575157000,neutral,"More confusion from Francis, the First Merciful Pope http://t.co/Rw9Hipkych"
641612134237929000,positive,@CatObserves Pope to make historic US Congress address on Sept 24 - News - http://t.co/8XJsF4pqvd http://t.co/EjHybZfW7t @jamaicaobserver
641612799878238000,neutral,Not Available
641612833893908000,positive,Pope concelebrates Mass with Armenian Patriarch: History was made on Monday when Pope Francis concelebrated mo... http://t.co/9ark3Hrrne
641616155619258000,neutral,"Skimmed it  May not LIKE the SCOTUS decision but it's THE LAW. No offense, but your Pope? Climate Change? seriously? https://t.co/xg2ErQjdvH"
641625265542688000,neutral,@irishfluke_ oh there UE Monday ok. I wonder what days we'll have cause of the Pope
641631024808656000,positive,"The Little-Known 9th C. Marriage Crisis &amp; the ""Great"" Pope Who Stood Firm | ChurchPOP http://t.co/PKpTEFoviF http://t.co/vBvM8J7gOw"
641641970981408000,positive,Not Available
641643033134563000,positive,The Pope RSVPd. Have you? Take your selfie with the pop-up Pope at our Fall Social on Monday! http://t.co/jHdq6ZvWIw
641643922549288000,neutral,@PopeLeoXII The theologians of the Church teach that the See may be vacant at the death or resignation of a Pope until a new one is elected.
641649333440499000,positive,tbh I may be even more excited about the Pope's joint session with The U.S. Congress than his public appearance/ Mass in philly
641652726309502000,neutral,How the pope's personal experience with annulments may have led to reforms https://t.co/ejAOvcirzw via @DeaconsBench
641655938315894000,positive,Come say hello this Saturday at Founder's Day... Just look for the Pope! http://t.co/auLKY5rtOp http://t.co/n1qIf1wPmm
641657524609904000,negative,We just got an email warning us that THE POPE IS COMING in two weeks. The next email said that BIEBER IS COMING tomorrow. ACK.
626083470415134000,positive,"Pride Parade - join the @VancouverPride festivities this Sunday happening in the West End, from 12-3pm! http://t.co/Np5PDOZ8lk"
